{
  "schemaVersion": 1,
  "tickHz": 50,
  "maxCatchupTicks": 5,
  "transition": { "freezeTicks": 6, "wulfArrivalDelayTicks": 12 },
  "difficulty": { "budgetBonusByPieces": [0, 0, 1, 1, 2], "maxRoomBudget": 6 },
  "exit": { "keeperNudgeZonePx": 0, "keeperNudgePx": 8 },
  "newGamePlus": {
    "levels": [
      { "pieces": [[0], [1], [2], [3]], "rampHeadStart": 0, "wulfSpeedPercent": 100 },
      { "pieces": [[0, 1], [2, 3]], "rampHeadStart": 2, "wulfSpeedPercent": 110 },
      { "pieces": [[0, 1, 2, 3]], "rampHeadStart": 3, "wulfSpeedPercent": 120 }
    ]
  },
  "features": {
    "caveHints": true,
    "animatedWater": false,
    "distanceDrivenGait": false,
    "roamingWulf": false,
    "inventedOrchids": false,
    "inventedCreatures": false,
    "quickSave": false,
    "bonusRooms": false,
    "pauseMap": false,
    "stats": true
  }
}
